{
  "counts": {
    "artifacts_csv": 6,
    "events": 8
  },
  "crop_circle": {
    "rotation": {
      "max_absDiffToR_all": 0.0,
      "max_absDiff_all": 0.0,
      "okAll": true
    }
  },
  "generated_utc": "2026-01-07T23:26:57.012Z",
  "guft": {
    "E": 0.645,
    "T": 0.645,
    "deltaS": null,
    "psi": 0.45525000000000004
  },
  "music": {
    "major": {
      "summary_ok": true
    },
    "minor": {
      "summary_ok": true
    }
  },
  "run_id": "d9dec8f172f8",
  "schema_version": "telemetry.v1",
  "telemetry_ok": {
    "all_ok": true,
    "crop_rotation_ok": true,
    "music_major_summary_ok": true,
    "music_minor_summary_ok": true
  },
  "timings": {
    "step_duration_sec": {
      "crop_circle_rotated_centers": 42.1796441078186,
      "music_profiles": 41.42817974090576,
      "tree_of_life_bands": 84.51564526557922
    }
  },
  "tree_of_life": {
    "E_mean": 0.645,
    "T_mean": 0.645,
    "band_counts": {
      "0": 1,
      "1": 3,
      "2": 3,
      "3": 2,
      "4": 1
    },
    "n_rows": 10,
    "psi_max": 1.0,
    "psi_mean": 0.45525000000000004,
    "psi_min": 0.04
  }
}